e20198f2-00a3-4bb2-8c47-9a028ae1c00c	5	This is the best home vacuum sealer on the market! Bar None! I have given my Food Saver to the Goodwill.
dc1899d8-d879-4a5b-b729-b9f711e01a36	1	I chose to overlook the fact that this is NOT A ROLLO CHAIN, as stated in the description and as shown in the photo.  That was my first mistake.  Anyway, after initial inspection, I put the necklace, unworn, back into the box, where it sat for almost two months (long story).  When I removed it from the box to wear it today, it had TARNISHED IN THE BOX, UNWORN!!!<br /><br />This vendor is not sending the product it promised and the product that is being sent is of grossly inferior quality.  Do yourself a favor and do not waste your time or money.
d4f9b6d1-5d01-45c5-a279-74a47faa4bd7	5	Excellent quality and shipping. Very pleased with the product.  Many of may fellow Masons would enjoy the ring.
f12a7e5d-2266-49cd-a684-835044185bcf	5	but the string wont last...
031d882a-b949-4b4e-8b99-ff4857d387c6	5	Love it
14b9303d-f778-4a07-99aa-57558145e08e	5	1st use produced a very nice, well browned and juicy bird. Added potato and onion to the tray and they cooked up very nicely. I've used it both on the grill and in the oven...works equally well. Order of magnitude better than fussing with beer cans or pedestals. Recommend it......it's worth the investment.
142b538f-388f-4e8e-a9fd-608e3d622790	3	Liked the rice cooker, but the cords can get in the way and the paddle holder could also be better designed.  I sure wished it was retractable cord.  Small convience can go a long way in higher rating.
bd86820f-0927-48f4-9180-ea6a83b8ae34	4	I like the drawers because it keeps the coffee cups organized and conserves space. Overall looks nice, only complaint is the drawers. They are a little loose but overall still a good purchase.
7775b562-d669-413a-9057-08d9ab152c6d	5	love this ring! wear it during cold season to insure my diamond engagement ring wont fall off...
e67d74c1-86f1-40ee-b233-d8f70307b55e	1	Just bad! sent it back to Mfg!
4e696a07-2b61-405e-8ff9-b11a5361dff3	5	Perfect!
f8fca6de-c39d-477f-a4fd-b4da20c6db32	5	This is my 2nd one as I accidentally broke the first (Christmas Gift). Very well made, and works very well hot chocolate.
b82de19b-725c-4b21-ac97-510cd21ff62e	5	It was exactly what I wanted. Easy to clean, easy to use, and pink! Which is important.
8dc8b0d1-f093-425c-b697-ab56fdd17683	5	This is the perfect wine preserver.
011a4841-6338-4a19-8acc-a6ccbdefc409	5	So pretty and sparly. While I think maybe the necklace might be a bit much, I have my eye on the matching bracelet.
53564ce9-c101-4ddb-ad4e-e8a7e7c41734	1	This juicer is actually really terrible! I read a lot of reviews and ended up getting this one. Had it a couple years and find it just is not useful. The small feed tube requires you to spend a lot of time prepping before you can actually juice. And this juicer does NOT does well with squishy fruit. Forget about juicing pineapple... it does not work. Anything squishy does not get pushed through the matiscator and you have to empty out the entire assembly to continue juicing. I would NOT recommend this to anyone who actually wants to juice regularly. You will spend way to much time for the whole process.
f0f3dcb2-aad7-4729-b5fb-3888dc932441	5	it is every ting and more
95421457-f542-434e-aff0-cdd634437e7a	2	Too small
e27e5df6-15d5-4633-a495-12c18161ba9e	5	i looove this!!
29449dfb-fbbb-4001-bef6-8fff102f53f7	5	Great Knife I use it a lot.
aa06e4ef-4809-4f3f-bcee-7b730344f4a6	5	I use this awesome bag as a handbag! Love it!
83d4a69b-28a6-4178-bb8d-cec15cf28564	5	This has been so easy to use and accurate. Love it.
605497c8-cb86-47cc-ae22-a00913446d88	1	Do not buy!  The coating peeled off on the first use...So much for doing gravy with the drippings!
e15cbf0f-be0f-4c6c-8ffe-7460e1f3cfa9	5	Very cute!
b8a82a12-7ea1-4c3f-946c-e27c9edb5295	5	This unit replaces a sqeezo that had been in my family for 40 years, works great. Easy cleanup. I also bought the  4 piece accessory kit for salsa<br />and berry sleeve(Jam).
110d2ecb-6887-4113-b13a-038fb60d7c07	5	Smaller then it looks in the pic but just the right size for Pre-K!
b5688331-6972-4ddc-8b18-8469ed2c76e1	5	I absolutely love my bracelet. I wear it every day. It means the world to me. Thank you to the holy land souvenir. I am looking to buy another one but I will see it's no longer available right now. Do you know if this item will be selling again?
6e3328b3-6458-49d3-b643-d0744f3bd949	5	This product is fantastic.  I was wary of the hype in the description but it is very simple to use and I sharpened all of my knives in a  few minutes - and they are VERY sharp - like new.  Its hard to tell from the picture that this sharpener is less than 3 inches wide and tall, so it fits easily in my knife drawer.
18377530-2a79-4ec8-aaf3-41b04560be89	4	The chain and bar are delicate and cute! The bar itself is approximately 2 inches wide. The only issue I've seen on myself so far is that sometimes the bar portion doesn't lie horizontally, but scoots up to be diagonal. It's cute and I would order another one!
8cb374ae-c8b9-4d12-913f-96f6499e8113	5	Super handy
80557652-ac83-48b5-b0bb-2e48a89ae0c6	5	After a month, I like the container a lot. It can hold one pound of whole coffee beans. It seems to keep the coffee fresh..The opener works smoothly.
88e66a00-273c-4e9a-aa8f-67fe0d9b3782	5	very well made. Makes good size popsicles.
45dd273c-5ac4-43dc-8ed6-d30d108eb293	1	One of these broke when I tried to lightly adjust the size
6a1dad68-0f5b-4189-9281-74a7f8d21ff8	5	Love it, just perfect.
84d4c7ab-04a4-4138-b21f-a5cbe2bbdbeb	3	I ordered two of these cups expecting assorted colors, instead I received two of the exact same colors so that was a little disappointing.  So.....it's just ok.
16ecc692-3d65-4b40-898f-563df4cd2bfd	4	Great!
b5ca790c-b8f1-4daf-9bf4-7463bc4544a9	5	Absolutely love this product. Works great with the food saver. I make fresh juice and salads in wide mouth jars and using this sealer allows it to stay fresh for about a week.
a60c3e9d-79b8-4ffe-9a97-97d2e00b15ff	5	When I first got these, I noticed the awesome gift box they came in. Then, inside were 4 individually wrapped packages of ear rings. The colors are vibrant and beautiful. I love that they are hinged and they have a locking clasp so they don't accidently fall out of your ears. I have been wearing these for 2 days now and they are lightweight and beautiful. They go with anything I could wear them with and they are sturdy enough for me to wear them 24/7 and not have to worry about taking them out at night.<br />*I received this product at a discount for my honest, unbiased review*
c7e8149a-8310-4d5f-b22d-ec5cd0f64047	5	Get the tank and have it replaced from a diy home brew shops
7912e691-ce7e-4492-a127-795716e8fd4d	1	I never got the product to work.
1f647b89-0044-4c1f-a1ea-61ec37b3a535	3	The cord began to unravel after wearing it for four days.
0c515d16-798d-4e48-8eca-8acc13ad1658	5	Can't believe how fast I can get my berries ready now. I have the stem puller and now this to slice. Makes everything so fast. The blades are stainless steel and very sharp…..built very well. Worth the money. Being 71 and my hands are stiff from arthritis this really helps me a lot.
2c4d326e-4c7a-4c10-87c4-3e2e428aef33	1	These containers are absolute garbage. We bought two, after 2 months the lid for the first one had a crack running down the centre, after 3 months the second one has multiple cracks. We're left with two bottoms, and no workable lids, unless you want Styrofoam in your food.
9609ec6f-211b-448a-a373-4bc78098560f	5	Great movie! great condition
0a5409ad-a8c0-4606-bf8d-6faefa57fd05	3	Very easy to use turned out great.
3bcf812f-fe88-4b61-883d-fa600f3ee484	1	Was broken when I got it!! Waste of money!
f9a0dfd2-4032-4858-80ac-63d53496e48c	5	Really cute, the back screw does come off here and there, but is my super active toddler who has them on.
9e7d6cc6-c62d-49ad-b96f-b4e30d198a2e	5	I have a necklace with the same color pattern, so I got these to go with-so happy, works well!
2ea0ca0b-dac8-4a08-a749-a3fa040960ec	5	Love how fast it works!  Not to loud and my daughter loves the smoothies we make with it!
bd54b369-254a-4602-afa3-150994297432	3	It was not a hit pink that i wanted and the jewl broke out after wearing it for a month. I didnt like it as well as i thought i would.
9cebb8f0-d861-4e6b-bb59-07b89d6da906	1	Terrible
685a2b73-3aec-4d49-9f89-8bc4077f5924	3	Got them way faster than expected I was content with the product only thing is the color is lighter than the picture I wanted dark gauges
35b9d104-3db6-48df-b3bb-10bc54fbd7cf	4	they were exactly what I was looking for...and they were shipped to us so quick.  Thanks,
7fe242ac-e844-4dfe-bfce-bde7f20b0c59	4	love it!
9ff710f7-896c-44b8-b379-9c2db5ea42e8	4	These are really pretty. However, if you have nipples bigger then a pencil eraser, this will not fit very well. It is cheap metal and will break if you bend it to roughly.
afadf913-abd4-436a-8ca8-270cb7eb404d	1	Unit leaked out of top spout and cap was very difficult to remove. returned for a refund
de48d136-7df1-4dc8-8410-18f0a97813cd	5	brand new and received free coasters
281fb66f-8395-4cf1-9072-8064bc58d9cc	4	Very pretty, fits well
0c967875-3a6f-4aeb-b922-42c5a185aa94	5	Very happy with this purchase. The water quality where we live isn't the best, it tastes horrible! After reading all the reviews between Pur and Brita, we decided on the Pur due to its high rankings, ability to clean and great tasting water. And we couldn't be happier with our choice. This is a great choice! It's slim profile takes up minimal room in the fridge while holding substantial water. The quality of the water is amazing, it tastes great! Overall, I wouldn't hesitate to purchase again.
71b6e072-1597-4368-9ae9-f9204ce3acdb	5	I love mood jewelry. I put the charm on a plain silver necklace and wear it just about everyday. I've never had a problem with mood jewelry changing colors and this one is no different. The colors are beautiful and I love wearing it.
0d7a1277-c653-4ebb-8524-2467712357ea	4	Beautiful  !!! I love it Thank you :) ♡♡♡♡
6247ac9f-ccf5-4df9-beac-e9af54d86ac0	5	Really works great
13daf93c-ce61-4004-85ab-6c88c9f30279	5	I was blown away by this device.  I expected something good, but received something beyond my expectations.  We've used this wok several times and have been totally satisfied with the results, each time.
58306131-9591-4793-b05f-eb98b7daa3a9	5	great. Came quick and was very inexpensive
022ec213-2d13-41d0-b98c-0baf04d8e3d5	5	I have purchased 2 of these so far. I like them so much, will go back and buy lots more for gifts and for myself.
06517fdf-b7b0-4055-bee5-e45bd8c6bfef	5	It was exactly what he wanted. A snug fit and the correct size. I bought for my other half. He loves it. Delivery was very good and received in a timely manner.
e8a5850d-9849-48c8-a44f-9585a6923aa9	4	Works great! Fits well in the fridge. The only reason it lost a star is that the bottom is not perfectly flat, which makes it rock some, which could be a disaster if bumped.
a96ad8d7-01f2-4c1a-b429-2dd9c6b06476	5	I was so excited to get this infuser bottle I couldn't wait. I love that the bottle has a lid to it that opens and closes. Its convenient to carry and has a rubber grip to the sides so it doesn't slip when it gets wet. Its durable to spills of any kind and best part is it holds 32 oz of water!!! The infuser is great and stores a large amount of any fruit to your liking. I will tell many of my friends and family to purchase this item!<br />*disclaimer item was purchased at a low cost amount in return for a honest nonbiased review
d17a38d6-058c-4861-b6d3-934517c7c909	5	Used for a baby shower cake.  Made white and pink out of choocolate.. looked like real buttons!  Adorable!
eef6fbba-dcd7-4c51-8ce4-cd205c323924	5	good quality
26e053b5-910f-40ff-8231-a45162718084	5	Beautiful Crystal Quartz stone purchased to wear on chain for healing qualities.
124a8ac2-6ab3-4fee-8200-e0cf484d04ae	5	This gadget is So Cool and Convenient!! Get It !!
a0321e36-efcc-4073-9f85-69092180e9ed	1	complete crap. Massively disappointed by this pathetically flimsy and extremely feminine necklace. chain is suuuuuper thin and literally broke as I put it on the first time.....
2019d0bf-b31d-4ad4-acb8-2657ff6db3c5	5	These were a gift the recipient loved them. They are beautiful in person and add a touch of magic to everyday life!
4dba88e1-ac67-42c4-80f6-8dd3d449dd71	5	The best little pan for frying up 1 perfectly shaped egg, and with a glass lid over it even if it doesnt fit perfectly, and low heat, I can even cook the top side of it as well with the steam trapped under the lid..<br />Love this !!!
163c0493-3b32-4bd1-8eb1-367c0d0e3039	5	Great to hv
ad89d9af-1227-436f-aec6-ddc963d8db4e	5	beautiful....
e8dc5827-49b5-490d-9259-3f77425d2b2f	5	If you use wooden spoons and spatulas in your kitchen, and you should be.  Viable Creations culinary set is the best I have owned. This is a very nice set, they are heavy duty, very well-made, and they feel good in your hands- both ergonomic and smooth.<br />I’ve been using them for all of my cooking needs and I’m completely happy about my purchase. You will not be disappointed with the quality of this set. I’m also impressed with Viable Creations customer service, very professional and helpful with questions I had about maintaining the spoons. Hand wash with mild soap and apply olive oil or a food safe oil occasionally to keep them looking new.<br /><br />I highly recommend this company and this bamboo set. 5 out of 5 stars.
39052c68-6238-41a0-9085-201949e459ff	5	I love the necklace, I wear it all the time,
676a773f-c41c-4e59-bfec-9f7c15118007	5	Cool!
cd1fc09b-fb28-43a2-bc72-b3329b2a63ff	5	ALL WAS GREAT
0e418a70-92ab-4310-9fee-d33efb795849	5	Christmas shopping early and will make an extra nice gift.
60327006-34da-4c88-9b22-038b5b286eec	5	I don't like using foil too much, it seems wasteful, but I use this when I'm in a hurry and don't want a lot of clean up.  It really cuts down on scrubbing/soaking time when I roast vegetables.  Roasted squashes, potatoes, or other root veggies, just slide off. Even aspargus with parmesan, the browned cheese slides off for a pretty serving and no scrubbing afterwards.
94a47aff-7a93-494f-8f40-2eab54454e95	5	I'm mildly allergic to surgical steel, so this has been in my conche for a solid 4 months.  Every now and then a ball will fall off when I'm cleaning my ear, but that's to be expected with any jewelry.
802f6d9c-614b-4f16-838a-73c7d98dfa21	2	Looks very cheesy I wouldn't purchase again
36fff17d-3edb-4c54-8687-2070b05510d2	5	Nice size Mandoline. Cuts like a dream and is easy to use. Have wanted one for a long time and now I have one. I would recommend this to any one wanting a very good product and the price was right .
f5c79205-9269-4fcd-86b5-4267ae7af93c	5	You will have to adjust the settings to make larger amounts of liquid but I just hit the button twice, for Example if I want a Macchiato I let it go thru it's cycle and then I hit the button on the coffee side, the largest one (i forgot the name of it) its does not change the flavor at all!! Great machine! Oh and the milk is not cold going thru. but if you like it hotter just do the milk cleaning first and it will make are the parts the milk goes thru, hot.
14ff5559-eb57-4f93-bd91-4aeba852f312	5	Great Coffee maker. Better than competitiors
a4b96feb-5a11-4209-bc7c-5f088dfc3a4b	1	Poor quality. Requested  refund.
7712a1ec-0fbc-45b4-98ad-a8874f775fc9	5	I love this set and I'm considering ordering another.  I ordered these to compliment my ceramic plates from Pier 1. They are so sturdy, that they seem like ceramic.  The small bowls were much smaller than expected, though, maybe only hold 2 tablespoons.
037329a0-0954-427a-a707-6dfd58bb5044	5	Very small but pretty. They are light weight and look very nice.
1de3492d-25a8-47ba-8160-c191fe671881	5	Very pretty pendant though the chain it comes on is flimsy.
9805d0d9-1519-4222-8af2-4df43d7d7b27	5	My girlfriend loves it !! It's very beautiful, great craftsmanship!
7be2d9b9-c7e1-48c3-aa23-83950cb2129e	5	I've comes out so easily. Does the trick
6ba33425-261a-4008-ba50-63a3643cb3c4	2	after using for a while now, the water after boiling appear to have unknown floats on the surface. looks dirty
56c4600d-cced-4aef-bf15-a23ddec388f1	4	Ver y nice disgn and nice cut,... But the black metal changes color quickly!! But still a nice product
1d8d6ae5-fb0d-4dbc-b74c-94ffa839d779	1	The ring I not 925 it started changing colors.
d1e92bcd-d3d2-4d8b-97f4-c171d85ac5df	5	While I usually like my necklaces a tad bigger than this, it turns out I was won over by this necklace just the way it was. It is really so beautiful and eye-catching! It doesn't seem to matter that it is synthetic. It is equally as lovely as the earrings I got to match that were real.
6f7ba9e7-60c9-4c6f-b672-3265d93310de	5	These earrings are even nicer in reality. They are lightweight and comfortable as well as attractive. Simple, yet elegant.
d2d3e3ed-e6ff-4829-85d5-20ad40ae9663	5	Awesome
abb75a7e-86b8-43be-9eb2-6f8e5ba25c3f	3	poor quality, but it did work for like 2 years until it fell apart entirely
19b910d9-3253-4376-9f73-b1aec56ac263	4	Still works
393b2f3c-5158-420a-a2b1-23c1f08e966a	5	I really like this unit! Make cheap cuts of meat taste like a Filet!
fdf56656-1016-485f-a3bf-79da1aeafe6a	1	Too hard to screw and unscrew broke the post trying to get them off. But they are cute for the price
faf7f15e-80c8-45b2-9b69-4e466894676e	5	Beautiful, and the wife really liked it.
cfbb8e61-d818-4bf6-9fc6-861068084631	5	Love it
d3f57ceb-38c8-471f-82fd-31d7f31579fc	3	This is a beautiful name bar chain except it did not come engraved. I filled out the part for the engraving, but it came with no name. I did not return it, I took it to a jeweler and had it engraved.
3de731d5-4854-42c2-b00e-37b50ef2b232	4	Very pretty and a great buy
46fdf467-f36d-4f3a-a4bf-3ba42aba50e8	5	Great size, great colors!
2b87b0cf-1f13-4574-b8a4-83773396ea5e	5	I bought 10 of these to present bracelets to my home EC class. They all loved it.
88f2e073-a32f-4c0f-b5a2-fcbed747a016	4	Beautiful!
f76f7b8d-de62-4776-a77f-06352cf7acc0	5	Cute
7bdca966-7a40-4190-ae6c-e878f088f048	5	I loved my first bracelet so much that I ordered 3 more! I do have large wrists for a female so they are snug when closed but no doubt these will fit a &quot;average&quot; wrist just fine. I just wear mine open and layered them up and put a little spin on the traditional bangle style. I do have to say that the flower can get caught on things from time to time BUT these beauties have held up!
7e6eaffe-4e0a-4fcd-be65-528d18737ca1	5	These are wonderful tongs! I just used them for canning peach jam, and they were perfect in lifting lids and jars out of boiling water.
752b0d2c-adb6-4079-9af1-0fd9493090e3	3	This travel mug serves its purpose in preventing leaks and spills, but it is not my favorite. It works great to keep your coffee hot for about an hour, and I can honestly say that it had never leaked. The unique button-release design is a simple yet effective approach to quickly taking a swig of coffee without having to fuss with cumbersome latches. However, there are two problems with this mug that I have encountered over a few months of use. 1. The hole that the coffee comes out of is much too small and makes it very difficult to sip hot coffee without burning yourself. This is a stark contrast to my yetti mug, which I use for both hot and cold beverages. 2. The lip of the plastic lid that you place into your mouth has a rough, grainy sort of texture. I prefer a slick, smooth plastic that resembles something closer to the feel of glass. Overall, I am satisfied with this purchase, and I received my mug in a timely fashion. But, this is not my go-to mug for coffee.
3fe82b84-1230-45e1-9e70-71408b111458	5	Beautiful wine stopper!!  Unique, because it is a functional 2-in-1 unit with the pourer and wine stopper.  Love it!  Would be a great gift or perfect Christmas stocking stuffer for your wine loving friends/family!!
95ed642c-6cb1-483f-99ae-a6937cb2b3fd	5	Great earrings. Nice weight. Fast delivery
7cf32b45-0d0c-4e97-8063-3b2c4af73ffe	5	I actually bought this to siphon grease out of the frying pan, when I'm cooking high fat meats, like hamburger and bacon.  It works like a charm and it cleans beautifully.  I use it often.  I've thrown it into the dishwasher - no fuss no muss.  Such a great kitchen tool!
266fc420-775c-48c9-b13d-ed455a51fc2f	5	Fits wrist perfectly.  Great material.  Nice!
149b3fcc-7fcc-455a-9161-3167a9bd9f1f	4	These earrings are beautiful - the colors are just as vibrant as the picture, they are well set and they look great in the box. So I was bummed when they didn't show off as nice on my ears. Everybody's ears are different, so I'm trying not to generalize, but on my ears, 2/3 of the earrings were off of my lobes and because of the weight, they sort of pull forward where the pin goes through and back at the bottom, so the earring hangs slanted backward. So people see more of the top of the setting, than the actual stones and it's hard to appreciate how pretty they are! I've never had this particular issue with earrings before, so I think they may be just slightly oddly weighted to look their best once they are in your ears. Still, the blues  are great and set off blue eyes really well and I'm sure for other people's ears they may look just as great in your ears as they do in the box.
6d593b63-17d9-47d8-82c9-43de8072fae1	4	Thought it was opal it's more like foggy clear. But it's cute
ea3ed858-3342-4128-91cb-7724f2348772	5	Using this for CP soap.  Nice 4.5 oz bar with tons of details.  Comes out of mold perfectly.  Mold is very pliable so be sure to have it on a sturdy board/tray if you plan on moving it after you pour them.
4252f1c2-c976-4ba4-966d-30d2eabda9e1	5	I run a RAOK (The Random Acts of Kindness) group on FB and one thing I send to people is scented wax. This has been a great help to help with sending wax
ebeb26cb-756a-4c60-a862-0d1f073832b5	5	Many comments love it , shows I stand with Christ .
54491e98-240f-4f17-aa4e-9278d32e83c0	1	broke right away.
4bf73b45-efdf-4626-952a-12441dde9de8	4	It ok what you see is what you get, nothing special.
0e114a73-5d8f-4aaf-980f-c0012acc3fd9	4	Nice size and fit perfectly. The black bands are removable so that you can clean under them.
5a0926db-e238-48e6-8d69-617a5d824c01	1	Does not make the job, bad quality.
5b6718e1-2602-4daa-bced-c38b25005e19	5	I've only had this cutting board for a few days but I am totally impressed. Doesn't slip on the counter, dishwasher friendly.  Hope it wears well.
c0ccd086-6c02-4126-adfc-ce752a58115f	1	The item was returned because the quality was very poor. Overpriced too!
7966cd84-00c1-42b1-b48c-c7c3369b489b	2	It is kind of hard to get the lids off of some of them and on the other hand, one of the lids didn't fit tightly enough and food spilled.
078f148e-1916-44fd-a7bf-e085af105329	5	I have had my K250 for about a month.  Before that I had the K40.  Both systems are very easy to use and make a great cup of coffee.  Coffee from a regular coffee maker doesn't seem to taste as good anymore. I would never go back to a regular coffee maker! The particular machine is very easy to use and the color options are great.  I personally have the turquoise and I love the colors vibrancy! I also love that this machine has an option to make your coffee stronger. I prefer to have the water reservoir to the side rather than the back of the machine. Having the reservoir to the side allows it to be removed easily for filling without having to move the machine each time or use a cup to fill it. I also wish it had an option to make the coffee hotter.  The temperature is good but adding cream definitely makes it a little cooler than I prefer.  Keurigs customer service is also impeccable.  I had pods that only worked with my old machine.  I called them and they replaced them for free and no questions asked!!! Overall this is an excellent machine for the cost.  I would buy it again and recommend it anyone!!! Keep up the good work Keurig!!!
8ff6533f-0dd9-44e4-a3b3-980abfb85edc	2	This coffee maker has doubled in price in one year so when you read the reviews you should consider that.  It makes coffee.  Period.  The lid leaks after putting in the dishwasher and I can't find a replacement carafe now.  It was fine for what I paid, but seriously. It just makes coffee like any other coffee maker.  I still have to heat it for 30 seconds for it to be hot enough for me just like I would any other normal coffee maker.
63db975b-931e-430d-94fe-5bfda6bf2b96	5	My wife bought these because she has sensitive ear and even the &#34;sensitive&#34; ear rings cause her ear lobes to swell.  These work great and no swelling.  We will be purchasing more stainless steel ear rings in the future
a4f82b2f-c7a5-48e0-aa60-83c58161745c	5	Lovely,very delicate color!
57dd90e3-bb58-4bce-a6de-d840095bccc2	5	This is a nice assortment. I have used it to figure out if I want to step up to pricier rings in sterling or gold. In the meantime, be sure to give these a good coating of clear nail lacquer because the metal will oxidize and turn your skin green...I am not complaining, understand, it goes with the territory.
