5f74113f-aaa3-43ab-97b6-d34e56bc14f2	5	If you're wondering from the slightly ambiguous wording in the item description (you know how some sellers would consider the tunnel one piece and the o-ring as another = 2 pcs) -- you DO get two tunnels and two rings of each gauge.<br /><br />The 14 gauges aren't &#34;tunnels&#34; in that they're so small there is no &#34;tube&#34; through them- they are solid, but they do match the style of the rest of the tunnels with the flared fronts and ridged back for holding your o-ring..  getting that TINY o-ring on is tough because it's so small so you might need help (I did).  Also, the 14gs were slightly larger than a standard 14g ring or taper.. not enough that I felt the need to grab my 12g taper, but enough that I did notice there was a difference and it needed a little extra push to get them through.  However, I will say- sleeping with tunnels in your double helixes?  WAY more comfortable than sleeping with rings in them.<br /><br />To be noted- the O-Rings have to be tight- otherwise, they slip off easily and if the o-ring doesn't stay on, your tunnel will fall out in your sleep, and all that stretching progress can be lost- especially if you're working with cartilage, so tight o-rings are a GOOD thing.<br /><br />I have piercings of a variety of sizes in my ears, and have been wanting to gauge my lobes from their 6g & 4gs to 00gs for ever, and just never got around to it..  This kit is perfect for me because I like to stairstep my stretching with a variety of sizes all at once- so I've always got at least one side of my head that I can sleep on.<br /><br />This kit is lovely.  I would never believe that it was a $3 set (when I bought it).  The metal is smooth and polished.  The tunnels are sturdy.  The rings fit tightly.  They're all labeled in individual resealable packages..  Aside from the 14 gauges being slightly large, I can't find any flaws with any of them.<br />This set is definitely worth the gamble.<br /><br />Came back to edit a week later--<br />I justwanted to add- a week in- and no problems, no skin reactions, no signs of rust (some cheap sets do that), the rings have stayed tight, and I still love them on all counts.<br /><br />Came back a MONTH later--<br />Once again, I came in to add- it's been a month with them in- and NO problems, no signs of rust, no deterioration of the o-rings- and I still love them.<br /><br />Came back TWO YEARS later--<br />I am still using these.  I have the two 10g in my helixes- they have been in there from day one- taken out only for cleaning, they have gone through showers/baths and hair products being sprayed around them every day for that entire time.  No sign of rust, no irritations, no issues whatsoever.  Not a single tunnel in the set has given me any trouble.  As time went by a few of the smallest o-rings got a little hard- but that did not lessen their ability to do their jobs- and I'm still using the original o-rings on them.<br /><br />If I could give them a higher rating I would.  I just can't tell you enough- even at the new price- THIS SET IS WORTH THE MONEY.<br />Awesome set for an even awesome-r price.
d48625d0-c533-49f3-b57a-d97b18316343	5	A+
1b171dfe-b13e-4c71-8337-12e102268f99	5	I now can cook a lot of dishes that require slow and long cooking time without burning them up because of this little helper here. It diffuses the heat evenly and prevent the pot or pan from burning or having food stick to the bottom for longer cooking time dishes.
4e1faad1-d049-4fef-9385-ecf1b0e54d48	4	Bamboo cutting board  Have only had it a few months.  Used regularly but seems to be holding up ok.  I did use some mineral oil to protect it as it doesn't have any kind of oiled finish on it.
de02cfdb-b10a-484f-957d-b0cf11cbdac5	5	Good price, perfect size, easy to clean.
c5564131-2e9f-4dcb-86af-b9e96f9bf647	5	Best serving tool. No scratches and very solid. Bought for myself and for a friend. We both love it.
c8d1378e-ca50-4ad8-99d3-3ebe5283933d	5	They are beautiful.  Thank you for sending them promptly. They were for my granddaughters to keep their mom close. They each love there pendant.
b0170384-c254-4720-a79a-63edbd9b8ed8	5	great
00965ac4-99f8-4feb-93db-1ff71ce1e134	5	Exactly as advertised.  These tongs have a good weight to them and I love the silicone lining to prevent burns.  Highly recommended.
45d3698e-2f0d-416c-9401-f3995eb13234	2	Fit perfectly but came in creased in half on one end so the choker is permanently bend out of shape and looks ugly and damaged in that one spot.
779112f6-073a-40bb-908e-514829d4ae1f	5	Nice ring<br />Solid built
063a89ac-dd7b-416c-885d-03e55c89d0aa	5	Love them.
ce603435-ce39-4ae8-bce2-c2a510fdee00	5	Arrived on time and is just as pictured. I have yet to take it off.
ae0fa17c-9ffb-4071-9fc6-956fc9876005	2	The pin is pretty, but the center red stone is severely off center.  It is as if it were glued on and slid 1/2 way off.  I don't know how that could have gone unnoticed.  I'm afraid if I pull the stone off to re-set, it will remove the stone's backing.
dc03bcf1-46c0-4ea9-8da1-36cfe52070aa	5	This ice cream maker is super easy to operate and I am so very pleased with how fast and good it freezes ice cream. I love that there is no mess with ice and salt!  I feel, your recipe will determine how hard or soft your ice cream ends up.  I used a recipe that I got years ago from milnot milk and it froze very nicely.  I was able to dip it and it hold shape by the time it was frozen!  You can see the ice cream churning and getting thick.  I like that I can add choc chips, nuts, coconut, or such towards the end through the opening in the lid... and the added bonus for me is being able to sneak a spoonful while it is freezing.  I read reviews about it being loud... I do agree-- it is loud, but it's worth it!  I like that it makes a small batch when it's just for me and my husband, but I do wish I could buy it in a bigger size too to use for family gatherings. You can buy extra bowls to keep in the freezer and make one batch after the other, but that doesn't serve everyone fresh ice cream at the same time.  I have to mention that I did buy some of the 6 oz tovolo ice cream containers to freeze leftovers in. While 6 oz may seem small, it is a nice portion to satisfy a sweet tooth without a ton of calories! When you are ready to eat one of them, the silicone lid stays soft and comes off easy.  If you let the ice cream set at room temp for just a few minutes (maybe 4-5 min) your spoon will dip in more easily.  I have even microwaved it for 10 seconds and that works great too.  I highly recommend this Ice Cream Maker... we use ours often!
5af384ff-31f8-4b20-96f1-d09c200e8877	5	Really happy with these ice molds. They work exactly as advertised, and I really enjoy having a chilled glass of bourbon without the drink being totally watered down by regular ice cubes.
fbb206f2-47b2-4ff6-b069-8428465d71fa	1	Most unreliable product I have ever used
a1023de8-b11f-4d96-9b0a-ace772ad6649	5	Perfect size, anodizing seems to be good quality! Very nice product for the money!
fc49957a-cae4-4324-8dac-e2a722880011	3	Looks exactly like picture, glitter is a little messy but it served its purpose!
0f2e9567-3cbb-4faf-8911-48dd972d9da9	5	A++
18cbcb38-a63c-4d87-8014-82d5c71fad84	5	Very happy with it
fd1f13fa-dd4a-467c-bdec-0e21fd60c1b2	4	Beautiful nose ring I order an 18 gauge which is what I wear, but I seems a lil long to me, although it hasn't come out.. Over all it's beautiful!!!!!
79dde4d8-3aa1-4b82-9a33-302e2be542f0	5	Very good
69918764-0326-4f9a-a6bc-62ce4c4fc40d	5	Seems very nice, easy to use. Not as big as expected, though.  Storage pouch smells like fresh tar so that will be discarded.
c5fed535-af63-465f-bdce-116446304c75	5	Absolutely beautiful.  I was very surprised how shiny and nicely made this bracelet is.  It makes such a nice gift also.
1d11ce64-6fa7-4f3d-9d54-750211e4c4fe	5	Perfect and neat!
3928466a-f794-4952-803b-57687685b694	5	Best thing ever it usually takes me a long time to finish my cereal so the fact that I can keep it from getting soggy is the best great product
4066d298-8da2-4d3d-900d-af3606c834a6	5	Love it and arrived quickly! Thank you!
9bd5b50f-b2ea-47d9-8ae8-351aefbac7f4	5	I love the Keurig system and have been using it for so long now at work, at my leasing office, at other people's events. I finally got my own and it is a gem to have- quick, easy, convenient, reliable, and i love that you can brew any type of coffee you want (preferably starbucks). It is just so handy! And it helps me stay awake, stay focused, and get my day or night going depending on what type of work I have to do. I would 100% recommend anyone to buy this machine, and keep the love for coffee and tea alive! Also,Thanks, Keurig, for the free pods for this review!
0170b1d0-af6c-43f5-a9c7-e368f84582d6	5	I read all the reviews.  There is nothing wrong with this item.  It is what it is and saying that its just a described it works great, I'm using it for more than just making Jelly I'm not a avid cook and its just great for me,  don't know what other people were expecting.  I'm very pleased.  Came with other items but still came early.
8acba203-c023-4681-8161-ef6eadff9146	2	If fits well with the machine, but, it makes such a horrible noise. I have to put paper around the base so it would make a quiter noise. Also, for a brand new item, its all scratch and looks foggy on the top.  I had to ship it to my best friend's house in Florida in order to get it here to Puerto Rico.  Honestly, noth worth a $100.00 dollars.
66b030d6-eb0a-4409-aea2-31e474c3740b	5	Perfect. Fast. Love the color. Still working after 2 years (used two times per days)
b6c622ea-ade6-4305-b6ab-8174bd47b0fd	5	escelent
57898d01-775a-4431-ab89-6d597a4f4f0b	1	Wasted my money, the first time I worn it , it fell apart and started changing color  immediately I know it was cheap but OMG in a few hours and gone not even a week I got to use it.
ae61e9c7-000f-4e3a-9460-a9312bc152eb	1	Made my belly button super infected and it started rejecting, I had to take it out and now I have a gross scar. Don't put colored metal in your belly before a year. The shape of the ring was so weird too.
30e4b35b-9129-47fc-afec-973862bf1a9b	5	These are so beautiful and I love to wear them. The silver is etched clearly and the contrasting black makes the earrings the only jewelry you need to wear.
a6a0db46-fb69-47a3-846a-c7800c05b035	5	This is a good piece of necklace. Wont' lose it. Thanks!
18ddc4bc-f7a3-4a99-bf63-80454b150f33	4	I think this was a great product with some flaws, I tried a zucchini, and in the end it worked great however it was hard to get it to stay on the prongs, and get it going to slice.  The blades are sharp and it is better then the hand held version.  I thought it was difficult to stabilize the fruit while pushing and turning the handle to cut.  I wouldn't say it is a loss though and will use this again and again.  I am sure once I get the hang of it it will be much easier. So dependng on what you want to use it for, I do recommend this product!
60a48004-f59c-4c3f-aabe-4857317fdaf2	5	I first did a very negative review of this product thinking they were way too small for my bread machine bread. However, I just realized that I had not opened the bag completely. They are perfect! I am so happy to have found a bag big enough for bread machine bread. Sorry if my first post made you had orate to order.
c2c30f6a-1a33-42a0-b72e-912931a97da5	5	Very share
b795dfcd-76bf-4cec-8c00-2a6d8f95ea44	5	These are even more beautiful in person.They shine and sparkle and look so beautifully vintage. They come with bullet clutch earring backs. They have stayed in with no problems. This photo doesn't do them justice. If you are looking for something unique and special, these are it!<br /><br />**I received these for a discount in exchange for my unbiased review**
c37e9681-022b-4923-a838-3746dc30827f	5	5 stars, looks just like the  picture and fast delivery thank you
cf9e68d0-7a62-4d0b-b051-886cca76d093	5	Very well made and does an excellent job and is easy on my hands.  I have arthritis and do not have a lot of strength in my hands any more.  I plan on hand washing to maintain the beautiful finish although it indicates dishwasher safe.  I shopped for quite awhile and chose this one pacifically because the handles do not  totally chose together which helps because closing my hand is difficult anymore.  I also like the larger bowl sometimes lemons can be quite large.
031fd19f-48a8-4923-b886-bca54d643465	2	It is pretty to look at and sturdy.  However, the garlic chamber is a little small (holds only one clove at a time) and the handles have seams which allow them to fill with water when you wash it.  I love OXO, so it won't stop me from trying and buying other products, but if I had known these two things about this garlic press, I wouldn't have ordered it.
24566674-58a7-422d-9033-b005bd86594e	5	love it!
0a7e6948-85fc-4292-9f8d-df22ccb541a2	2	Kind of cheap looking and looks more like a cherry.
052fdb81-f4a9-4b0a-a913-2763be6546b2	1	When an item is so heavy you have to ask your husband to help you take it out of the box, you know already that this is not something you are going to enjoy using in your kitchen!<br />OK, maybe I should have read the fine print more carefully, but would anyone expect a grill that the cook is expected to position over stove burners and clean up manually afterwards to weigh 19 pounds? That may have been my fault, but I did read enough to reassure myself from the Amazon page that the grill was dishwasher safe; the manual, however, says to wash by hand with mild detergent, like most cast-iron.<br />I had hoped to use this grill in my oven as an adjunct to the normal broiler pan, but it is JUST too wide to do so. I started to slide it into the oven, but it was scraping the sides of the oven,so I desisted.  Its surface is rough enough that I fear it is also likely to scratch my glass cooktop, and the rough surface, large size, and weight make me also think it may scratch my sink when I clean it.<br />If I were big and strong, I think this might be a nice accessory for my outdoor grill, but it is not something I am willing to use in my kitchen. Sorry, Rick, no me gusta.
6b6a4006-f1c0-4648-acf7-6d8f73f5c3bc	5	I love it!!!! it is not cheep medal and it arrived on time and im really satisfied with the product!!!!!
8694795b-258f-47e1-bf54-c12d1c8629d1	5	Fit perfect! Exactly what I want and now I've ordered 5 more sets from urban body jewelry
05f10bb4-aea1-4808-8c9f-ca1feaa6687e	2	Pretty, but the straight wire looks cheap & feels flimsy. Made me sad.
508381f2-d295-46fd-87da-ec16cb5c2f1a	5	well worth it!
2069df2f-d8a4-4da6-9c41-80b3d34ae07e	5	My daughter loved this so much when it arrived.  She wears it in her wrist! Is is well made and beautiful.
22f8fabd-7884-4dca-88d0-fa1b8bfbc55e	5	Beautiful. The photo doesn't do it justice!
cfdd48a7-8ff3-4de9-85ce-394109134144	5	Beautiful
b3e45891-65b2-40d6-84a7-7adc26b5d5b5	3	I love this little bracelet, it did turn my arm green though after the first wearing. :( So I can only give it about three stars. It is super cute, but needs to be coated.
75c68af6-bfde-4f38-9bc6-fe65e6b0921c	3	I am disappointed in these earrings.  They are much smaller than expected and they look sort of glued together.  The part that is supposed to be mother of pearl looks rather like plastic up close.  Since I got them for only $34.00 I kept them.  They are not bad, just not nearly as nice as I expected for their original price of about $100.00.
3729140e-8b82-409b-beda-709d66d3a5ee	5	All pieces are great .! I like to switch my tongue rings out cause after a while they tend to get kinda nasty. You really can't beat the price on this .! And I love the designs. There is at least one thing for everyone .!
0876e7a7-8ede-4451-8ae1-c8e10b20dcdd	4	wasn't sure if i would like it so i brought it to a beach rental as the knives are always dull and of medium to low quality.  It did a nice job sharpening up a set of Faberware knives with a little time.  Good purchase, works well!
888d4ae7-b04e-4584-a302-76e2dcaa1cb6	5	good
fed7b9e3-172e-48a5-9315-b7b8d2adf095	5	Love them!
7d71af97-8409-4851-ab0e-7dd7ec53e0e4	5	Great addition to the Big Berkey.  This stand makes it so easy to put filtration system anywhere I want on my counter and put the glass right under the spout to fill 'er up!
b751a1be-2473-4144-853e-ce1f867c1189	5	Love it!! The chain is so delicate and the pendant is so pretty!!!
677cfb18-46c6-4770-b481-a60eb2b49dc1	5	Well made and durable.
53490736-3f8b-4212-9698-afc6a9819c58	5	Absolutely beautiful necklace and earrings. Thank you so much. Exactly what I wanted
e9430d61-117e-4578-a6e6-3037e9112fef	5	This is a very beautiful necklace. The pendant is smaller than pictured, but is still large enough to be seen and look classy without being &#34;gaudy&#34;  The sterling silver box chain is nice, but I prefer a slightly longer chain, so I replaced it with one I already had. The pearl, as well as the other stones are securely fastened in place, with no sign of adhesive or fasteners.  The stones are very tight as well.  I think this is a lovely piece of jewelry, and I would not think twice about purchasing another piece of jewelry from this company.
9ceb1b30-f0f2-4c2b-9b4d-654f8ddb4574	1	Broke after 2 days
b6fe871a-2e58-4e56-a9dd-656a072f6106	5	Love this necklace it was perfect.
17cd7ef6-e12f-40c5-8797-11105f97c57a	5	Perfect for under my toaster oven.  Just what I was looking for.
dddf4365-a160-49d4-b229-d7bde498db4e	5	My wife and I were looking for reusable straws after we acquired iced coffee addictions and were burning through regular straws. I was unsure how I'd like using a silicone straw but after doing a simple wash as instructed they worked great and didn't have any sort of plasticky taste.The fact that they separate at the curve is also brilliant and makes them super easy to clean.<br /><br />Can't wait to buy more as gifts for family and friends!
69a36c2b-7250-4308-9661-3776076d7353	5	thanks - good item
c35beead-a5ea-43d8-b183-5c4c3fa0d995	4	Thought the spheres would be a little bigger but overall a great product!
dcbb3511-b3b0-415f-96d5-34bb80c4c70c	4	Very attractive; a fun, functional find.  Great in the car or at home.
59dc9143-4328-41c1-a518-ce947c442884	2	Cheap
ab476964-1b81-4aa5-91fd-5af1eaea0a42	4	I just love my juicer. This was the first juicer that I purchased. It works well. Cleaning could be a little easier but other than that it works great. Juices  everything I love. You must cut your fruit in smaller pieces with this juicer.
fb09b323-5b04-4bb3-9f08-30c6f8e63e9c	5	Great product love it, would buy another
7a8408f1-8234-4372-b1e6-bbcc9bb744c9	5	These come in real handy for visitors make up some and keep on hand.Of course I use mine up when I'm lazy and don't want to make up a cup then wash it and put it away just use and toss.
1e7a9da5-e0bd-4830-9637-99799c54ea2b	5	I've used this bottle several times already and I really like. Great bottle for the price. I noticed that some customers stated that their bottle leaks, I haven't had that problem. I done all the leak test i could think of but mine doesn't leak. If you have a problem with leaks when you first get it make sure the lid is on properly. I will be ordering another bottle soon.
6b21f9c0-6d36-4f2d-aac5-7bdc2731c36d	1	It broke the first week i had it....
7c705f28-80aa-4d3a-a4c5-1a6a9d0f1384	5	Item as decribed and adorable!!!
bc51bfc6-c3e1-478b-ab29-1c34c576c8db	4	So far so good. Just have to be careful as there is a learning curve to opening and shutting them if the contents is even a little melted. I think maybe 8 and up could handle it in a lunchbox.
2e06b8bc-fd6d-4dc0-a364-82ab4abb2689	4	The thickness of the top doesnt allow the Keurig to close nicely, but it functions well.  What I like the best is that I no longer have to monkey with the stupid sensor that gave me grief when I used my other k-cups.  I just finished my first cup of joe from the k-cup and aside from adjusting my brew strength over the next couple of cups, it is ideal.<br /><br />FOR THOSE WONDERING, APPARENTLY THE MANUFACTURER DID SOMETHING WITH THE COLOR DIE IN THE TOP OF THE K-CUP THAT TELLS THE SENSOR THIS IS AN OFFICIAL K-CUP FOR A 2.0 MACHINE.  THIS IS PERFECT!
aaae85ef-83ee-4deb-b6f6-f72be1b4b612	5	i love it
a5d78c4b-a48b-4efb-9dac-bdc2659f501e	5	I think these are very pretty earrings, and appear to be well made.
d291f359-d8c1-47a1-a745-ddecc3b27dc6	5	This is a very pretty bracelet and looks just like the picture.
174856b8-e940-488f-8b60-338d181f144b	4	Beautiful copper  but the wrist straps are a bit flimsy.  Love it though and it looks great.
3fee491b-b845-4d7c-9301-80d5fb854db8	5	This is my second one of these...my son took the first one for his new condo.  One of the secrets of really good coffee...it needs to be hot!  Great coffee maker!!
d8237ff3-05d0-4a4d-acc4-5690b11a0b74	4	Very nice earrings and great price. 10 yr old daughter loves them.
3a99b893-e7b0-4602-876a-5b31edc3bb02	5	I lost a one of a kind Tree of Life ring and was pleased to find this similar ring.  Great buy and a perfect meaning.
8dc0b64c-7f2c-4576-b129-4f1a867bf3be	4	Smaller than thought but quality charm
81ca1b53-c347-4741-a230-9571465d9b11	4	Heavy-duty ice cream scoop made in the USA, hip hip hurray. It is weighty and sturdy. FYI, the &#34;color&#34; indicates the size of the scoop. It has nothing to do with coordinating with your kitchen. Blue is 3 ounces times two scoops for you and me, and everybody is happy as a clam. NOTE: as instructions clearly state. Do NOT wash in dishwasher. I have other similar aluminum ice cream scoopers and have never had an issue with corrosion.
9bb2c221-e16f-4d78-bad8-9048db4e62a7	5	I got this for my mom and she loves it.
9d3a40ef-994c-4cb3-b49c-10292583a639	5	A winner, my wife liked it.
3195b911-42af-4b26-a965-4f017a8ee566	2	Very nice, but broke almost immediately
52170b3d-1355-4143-8e56-60a6a9769743	5	I'm so happy with this purchase.  It is more beautiful in person.  Good quality.  I did buy a different chain.  I needed it to be a bit longer & more sturdy.  I had difficulty getting the cremains in using the funnel, so I used to spoon provided & carefully &#34;poured&#34; them in.  This necklace holds a lot so be patient.  Shipping was fast.
90bade87-e249-4490-8698-4f5ee028f709	5	Made in America. Ox
e9c5886f-3436-4ca4-b90a-d943fd856654	4	As someone who loves to cook in the kitchen and enjoys a nice poached egg, I was eager to try the Silicone Egg Poacher 4 Pack by Kitchen Essentials.  I have never tried anything like this before, so I was excited to see how it worked out.I like that all of the egg stays in the silicone cup and I don't lose any in the pot like I normally do. Nothing stuck and they were easily cleaned with soap and water. I put wooden skewers through the holes to keep it stable on the rim of the simmering water and melted some chocolate too.  I am going to try other ways to use these egg poachers.  I think they are really nice and work good.  I received this product in exchange for a review. All my opinions are my own, based on my personal experience with the product. I am disclosing this in accordance with the Federal Trade Commission’s 16 CFR, Part 255: Guides Concerning the Use of Endorsements and Testimonials in Advertising
e87b1b1b-0a57-4c9a-9982-ab060bdaa975	5	This is my favorite ring! I have had it for about two years and barely ever take it off. It is very sturdy, awesome details and I get a lot of compliments for it!
f282686b-f210-467d-b7db-46b2e950e957	5	Excellent Item
29f72764-6d3e-49af-bada-a6bb9a445e22	5	I really like this bottle. Very well made, and the wide body construction makes it easy to clean.
7a10a71a-8b06-4eb7-b33b-a88d6b3e92c5	5	I used to gaze at the fancier bottles of wine in my collection yearning to drink them, but completely befuddled as to how to find the bottle's cork.  I knew the cork was hiding somewhere underneath the shiny metal foil firmly affixed to the bottle neck, shimmering like an elusive mirage.  However, attempts to remove this stubborn oenophilic chastity belt with a knife or a scissors proved futile, and on one occasion practically fatal.  While awaiting paramedics to arrive after severing a major artery and collapsing face down in a puddle of my own blood, I vowed to never again risk my own life attempting to remove another dastardly wine foil.<br /><br />And so I was sadly relegated to drinking screw-top bottles of wine, doomed to live a pathetic, solitary life.  I soon learned that nobody wants to be with a man who only drinks screw top or boxed wines; that's no a man, that's a child.  Feeling hopeless and lonely, I decided to cash in my life savings and move to Minsk where I could spend the rest of my days drowning my sorrows in bottles of vodka with easily removable caps.<br /><br />In a shocking twist of fate, on the morning of the day I was set to leave on a one-way flight to Minsk with no possibility of return, I happened upon an advertisement for a life-saving product called Edgy.  Edgy provides a safe, reliable way to remove wine foils with no messes and no accidents.  Now, the fancy bottles of wine that used to mock and taunt me are crushed like ladybugs.  I guzzle Domaine Leflaive Montrachets, Screaming Eagle Cabernets, and Henri Jayer Richebourg Cotes de Nuits like bottles of water, all thanks to Edgy.  Yes, I am now drunk literally all of the time, but I'm also happily married (I think) to a woman (I think) who is stunningly beautiful (I think).  And it's all because of Edgy.<br /><br />So thank you, Edgy, for saving my life.
7bbc7e4c-dcfc-429d-97de-df378cc2d354	5	Works great! Cannot see any difference in the popular name brand and these.
d01d3dff-aa01-4200-b262-83be531533a0	4	a little bigger than i had imagined.but well made.
